{
  "schemaVersion": 1,
  "documentType": "official_calendar_overrides",
  "jurisdiction": {
    "country": "VN",
    "subdivision": null
  },
  "year": 2014,
  "scheduleScope": "public_sector_schedule",
  "status": "published",
  "updatedAt": "2026-08-13T00:00:00Z",
  "sources": [
    {
      "id": "vn-molisa-5083-2013",
      "title": "Thông báo số 5083/TB-BLĐTBXH về lịch nghỉ Tết Âm lịch và hoán đổi ngày nghỉ lễ 2014",
      "authority": "Bộ Lao động - Thương binh và Xã hội",
      "url": "https://thuvienphapluat.vn/van-ban/Lao-dong-Tien-luong/Thong-bao-5083-TB-BLDTBXH-nghi-Tet-Am-lich-hoan-doi-ngay-nghi-dip-nghi-le-2014-217520.aspx",
      "publishedAt": "2013-12-23"
    }
  ],
  "entries": [
    {
      "id": "vn.2014.lunar-new-year.exchange-workday-1",
      "date": "2014-01-25",
      "type": "compensatory_workday",
      "title": "Làm bù Tết Nguyên Đán",
      "holidayId": "vn.lunar-new-year",
      "sourceIds": ["vn-molisa-5083-2013"]
    },
    {
      "id": "vn.2014.lunar-new-year.exchange-leave-1",
      "date": "2014-01-28",
      "type": "official_leave",
      "title": "Nghỉ hoán đổi Tết Nguyên Đán",
      "holidayId": "vn.lunar-new-year",
      "sourceIds": ["vn-molisa-5083-2013"]
    },
    {
      "id": "vn.2014.lunar-new-year.exchange-leave-2",
      "date": "2014-01-29",
      "type": "official_leave",
      "title": "Nghỉ hoán đổi Tết Nguyên Đán",
      "holidayId": "vn.lunar-new-year",
      "sourceIds": ["vn-molisa-5083-2013"]
    },
    {
      "id": "vn.2014.lunar-new-year.exchange-workday-2",
      "date": "2014-02-08",
      "type": "compensatory_workday",
      "title": "Làm bù Tết Nguyên Đán",
      "holidayId": "vn.lunar-new-year",
      "sourceIds": ["vn-molisa-5083-2013"]
    },
    {
      "id": "vn.2014.reunification-day.exchange-workday",
      "date": "2014-04-26",
      "type": "compensatory_workday",
      "title": "Làm bù dịp lễ 30/4",
      "holidayId": "vn.reunification-day",
      "sourceIds": ["vn-molisa-5083-2013"]
    },
    {
      "id": "vn.2014.reunification-day.exchange-leave",
      "date": "2014-05-02",
      "type": "official_leave",
      "title": "Nghỉ hoán đổi dịp lễ 30/4",
      "holidayId": "vn.reunification-day",
      "sourceIds": ["vn-molisa-5083-2013"]
    },
    {
      "id": "vn.2014.national-day.exchange-leave",
      "date": "2014-09-01",
      "type": "official_leave",
      "title": "Nghỉ hoán đổi Quốc khánh",
      "holidayId": "vn.national-day",
      "sourceIds": ["vn-molisa-5083-2013"]
    },
    {
      "id": "vn.2014.national-day.exchange-workday",
      "date": "2014-09-06",
      "type": "compensatory_workday",
      "title": "Làm bù Quốc khánh",
      "holidayId": "vn.national-day",
      "sourceIds": ["vn-molisa-5083-2013"]
    }
  ]
}
