{
  "schemaVersion": 1,
  "documentType": "official_calendar_overrides",
  "jurisdiction": {
    "country": "VN",
    "subdivision": null
  },
  "year": 2015,
  "scheduleScope": "public_sector_schedule",
  "status": "published",
  "updatedAt": "2026-08-13T00:00:00Z",
  "sources": [
    {
      "id": "vn-molisa-4724-2014",
      "title": "Thông báo số 4724/TB-LĐTBXH về việc hoán đổi ngày nghỉ lễ, Tết năm 2015",
      "authority": "Bộ Lao động - Thương binh và Xã hội",
      "url": "https://thuvienphapluat.vn/van-ban/Lao-dong-Tien-luong/Thong-bao-4724-TB-LDTBXH-hoan-doi-ngay-nghi-ngay-di-lam-bu-cac-dip-nghi-le-Tet-2015-260172.aspx",
      "publishedAt": "2014-12-11"
    }
  ],
  "entries": [
    {
      "id": "vn.2015.new-years-day.exchange-leave",
      "date": "2015-01-02",
      "type": "official_leave",
      "title": "Nghỉ hoán đổi Tết Dương lịch",
      "holidayId": "vn.new-years-day",
      "sourceIds": ["vn-molisa-4724-2014"]
    },
    {
      "id": "vn.2015.new-years-day.exchange-workday",
      "date": "2014-12-27",
      "type": "compensatory_workday",
      "title": "Làm bù Tết Dương lịch",
      "holidayId": "vn.new-years-day",
      "sourceIds": ["vn-molisa-4724-2014"]
    },
    {
      "id": "vn.2015.lunar-new-year.exchange-leave",
      "date": "2015-02-16",
      "type": "official_leave",
      "title": "Nghỉ hoán đổi Tết Nguyên Đán",
      "holidayId": "vn.lunar-new-year",
      "sourceIds": ["vn-molisa-4724-2014"]
    },
    {
      "id": "vn.2015.lunar-new-year.exchange-workday",
      "date": "2015-02-14",
      "type": "compensatory_workday",
      "title": "Làm bù Tết Nguyên Đán",
      "holidayId": "vn.lunar-new-year",
      "sourceIds": ["vn-molisa-4724-2014"]
    },
    {
      "id": "vn.2015.lunar-new-year.leave-1",
      "date": "2015-02-17",
      "type": "official_leave",
      "title": "Nghỉ Tết Nguyên Đán",
      "holidayId": "vn.lunar-new-year",
      "sourceIds": ["vn-molisa-4724-2014"]
    },
    {
      "id": "vn.2015.lunar-new-year.leave-2",
      "date": "2015-02-18",
      "type": "official_leave",
      "title": "Nghỉ Tết Nguyên Đán",
      "holidayId": "vn.lunar-new-year",
      "sourceIds": ["vn-molisa-4724-2014"]
    },
    {
      "id": "vn.2015.lunar-new-year.leave-3",
      "date": "2015-02-19",
      "type": "official_leave",
      "title": "Nghỉ Tết Nguyên Đán",
      "holidayId": "vn.lunar-new-year",
      "sourceIds": ["vn-molisa-4724-2014"]
    },
    {
      "id": "vn.2015.lunar-new-year.leave-4",
      "date": "2015-02-20",
      "type": "official_leave",
      "title": "Nghỉ Tết Nguyên Đán",
      "holidayId": "vn.lunar-new-year",
      "sourceIds": ["vn-molisa-4724-2014"]
    },
    {
      "id": "vn.2015.lunar-new-year.leave-5",
      "date": "2015-02-21",
      "type": "official_leave",
      "title": "Nghỉ Tết Nguyên Đán",
      "holidayId": "vn.lunar-new-year",
      "sourceIds": ["vn-molisa-4724-2014"]
    },
    {
      "id": "vn.2015.lunar-new-year.compensatory-leave",
      "date": "2015-02-23",
      "type": "compensatory_leave",
      "title": "Nghỉ bù Tết Nguyên Đán",
      "holidayId": "vn.lunar-new-year",
      "sourceIds": ["vn-molisa-4724-2014"]
    },
    {
      "id": "vn.2015.hung-kings.exchange-leave",
      "date": "2015-04-29",
      "type": "official_leave",
      "title": "Nghỉ hoán đổi dịp lễ 30/4",
      "holidayId": "vn.reunification-day",
      "sourceIds": ["vn-molisa-4724-2014"]
    },
    {
      "id": "vn.2015.hung-kings.exchange-workday",
      "date": "2015-04-25",
      "type": "compensatory_workday",
      "title": "Làm bù dịp lễ 30/4",
      "holidayId": "vn.reunification-day",
      "sourceIds": ["vn-molisa-4724-2014"]
    }
  ]
}
