{
  "schemaVersion": 1,
  "documentType": "official_calendar_overrides",
  "jurisdiction": {
    "country": "KR",
    "subdivision": null
  },
  "year": 2020,
  "scheduleScope": "nationwide_statutory",
  "status": "published",
  "updatedAt": "2026-08-13T00:00:00Z",
  "sources": [
    {
      "id": "kr-moleg-2020",
      "title": "2020년 관공서의 공휴일",
      "authority": "인사혁신처",
      "url": "https://www.mpm.go.kr/",
      "publishedAt": "2019-06-01"
    }
  ],
  "entries": [
    {
      "id": "kr.2020.seollal.leave-before",
      "date": "2020-01-24",
      "type": "official_leave",
      "title": "설날 연휴",
      "holidayId": "kr.seollal",
      "sourceIds": [
        "kr-moleg-2020"
      ]
    },
    {
      "id": "kr.2020.seollal.day",
      "date": "2020-01-25",
      "type": "official_leave",
      "title": "설날",
      "holidayId": "kr.seollal",
      "sourceIds": [
        "kr-moleg-2020"
      ]
    },
    {
      "id": "kr.2020.seollal.leave-after",
      "date": "2020-01-26",
      "type": "official_leave",
      "title": "설날 연휴",
      "holidayId": "kr.seollal",
      "sourceIds": [
        "kr-moleg-2020"
      ]
    },
    {
      "id": "kr.2020.seollal.substitute",
      "date": "2020-01-27",
      "type": "compensatory_leave",
      "title": "설날 대체공휴일",
      "holidayId": "kr.seollal",
      "sourceIds": [
        "kr-moleg-2020"
      ]
    },
    {
      "id": "kr.2020.legislative-election",
      "date": "2020-04-15",
      "type": "official_holiday",
      "title": "제21대 국회의원선거",
      "holidayId": "kr.election-day",
      "sourceIds": [
        "kr-moleg-2020"
      ]
    },
    {
      "id": "kr.2020.chuseok.leave-before",
      "date": "2020-09-30",
      "type": "official_leave",
      "title": "추석 연휴",
      "holidayId": "kr.chuseok",
      "sourceIds": [
        "kr-moleg-2020"
      ]
    },
    {
      "id": "kr.2020.chuseok.day",
      "date": "2020-10-01",
      "type": "official_leave",
      "title": "추석",
      "holidayId": "kr.chuseok",
      "sourceIds": [
        "kr-moleg-2020"
      ]
    },
    {
      "id": "kr.2020.chuseok.leave-after",
      "date": "2020-10-02",
      "type": "official_leave",
      "title": "추석 연휴",
      "holidayId": "kr.chuseok",
      "sourceIds": [
        "kr-moleg-2020"
      ]
    }
  ]
}