{
  "schemaVersion": 1,
  "documentType": "official_calendar_overrides",
  "jurisdiction": {
    "country": "KR",
    "subdivision": null
  },
  "year": 2025,
  "scheduleScope": "nationwide_statutory",
  "status": "published",
  "updatedAt": "2026-08-13T00:00:00Z",
  "sources": [
    {
      "id": "kr-moleg-2025",
      "title": "2025년 관공서의 공휴일",
      "authority": "인사혁신처",
      "url": "https://www.mpm.go.kr/",
      "publishedAt": "2024-06-01"
    }
  ],
  "entries": [
    {
      "id": "kr.2025.seollal.leave-before",
      "date": "2025-01-28",
      "type": "official_leave",
      "title": "설날 연휴",
      "holidayId": "kr.seollal",
      "sourceIds": ["kr-moleg-2025"]
    },
    {
      "id": "kr.2025.seollal.day",
      "date": "2025-01-29",
      "type": "official_leave",
      "title": "설날",
      "holidayId": "kr.seollal",
      "sourceIds": ["kr-moleg-2025"]
    },
    {
      "id": "kr.2025.seollal.leave-after",
      "date": "2025-01-30",
      "type": "official_leave",
      "title": "설날 연휴",
      "holidayId": "kr.seollal",
      "sourceIds": ["kr-moleg-2025"]
    },
    {
      "id": "kr.2025.independence-movement.substitute",
      "date": "2025-03-03",
      "type": "compensatory_leave",
      "title": "3·1절 대체공휴일",
      "holidayId": "kr.independence-movement-day",
      "sourceIds": ["kr-moleg-2025"]
    },
    {
      "id": "kr.2025.childrens-day.substitute",
      "date": "2025-05-06",
      "type": "compensatory_leave",
      "title": "어린이날 대체공휴일",
      "holidayId": "kr.childrens-day",
      "sourceIds": ["kr-moleg-2025"]
    },
    {
      "id": "kr.2025.chuseok.leave-before",
      "date": "2025-10-05",
      "type": "official_leave",
      "title": "추석 연휴",
      "holidayId": "kr.chuseok",
      "sourceIds": ["kr-moleg-2025"]
    },
    {
      "id": "kr.2025.chuseok.day",
      "date": "2025-10-06",
      "type": "official_leave",
      "title": "추석",
      "holidayId": "kr.chuseok",
      "sourceIds": ["kr-moleg-2025"]
    },
    {
      "id": "kr.2025.chuseok.leave-after",
      "date": "2025-10-07",
      "type": "official_leave",
      "title": "추석 연휴",
      "holidayId": "kr.chuseok",
      "sourceIds": ["kr-moleg-2025"]
    },
    {
      "id": "kr.2025.chuseok.substitute",
      "date": "2025-10-08",
      "type": "compensatory_leave",
      "title": "추석 대체공휴일",
      "holidayId": "kr.chuseok",
      "sourceIds": ["kr-moleg-2025"]
    }
  ]
}
