{
  "schemaVersion": 1,
  "documentType": "official_calendar_overrides",
  "jurisdiction": { "country": "VN", "subdivision": null },
  "year": 2024,
  "scheduleScope": "public_sector_schedule",
  "status": "published",
  "updatedAt": "2026-08-13T00:00:00Z",
  "sources": [
    {
      "id": "vn-office-gov-8662-2023",
      "title": "Công văn số 8662/VPCP-KGVX về nghỉ Tết Âm lịch và Quốc khánh năm 2024",
      "authority": "Văn phòng Chính phủ",
      "url": "https://xaydungchinhsach.chinhphu.vn/lich-nghi-tet-nguyen-dan-giap-thin-nam-2024-11923110317204931.htm",
      "publishedAt": "2023-11-03"
    },
    {
      "id": "vn-office-gov-2450-2024",
      "title": "Văn bản số 2450/VPCP-KGVX về hoán đổi ngày làm việc dịp 30/4 - 1/5",
      "authority": "Văn phòng Chính phủ",
      "url": "https://baochinhphu.vn/nghi-le-30-4-1-5-thu-tuong-chot-nghi-5-ngay-102240412180501967.htm",
      "publishedAt": "2024-04-12"
    }
  ],
  "entries": [
    {
      "id": "vn.2024.lunar-new-year.leave-before-2",
      "date": "2024-02-08",
      "type": "official_leave",
      "title": "Nghỉ Tết Nguyên Đán",
      "holidayId": "vn.lunar-new-year",
      "sourceIds": ["vn-office-gov-8662-2023"]
    },
    {
      "id": "vn.2024.lunar-new-year.leave-before-1",
      "date": "2024-02-09",
      "type": "official_leave",
      "title": "Nghỉ Tết Nguyên Đán",
      "holidayId": "vn.lunar-new-year",
      "sourceIds": ["vn-office-gov-8662-2023"]
    },
    {
      "id": "vn.2024.lunar-new-year.leave-after-1",
      "date": "2024-02-11",
      "type": "official_leave",
      "title": "Nghỉ Tết Nguyên Đán",
      "holidayId": "vn.lunar-new-year",
      "sourceIds": ["vn-office-gov-8662-2023"]
    },
    {
      "id": "vn.2024.lunar-new-year.leave-after-2",
      "date": "2024-02-12",
      "type": "official_leave",
      "title": "Nghỉ Tết Nguyên Đán",
      "holidayId": "vn.lunar-new-year",
      "sourceIds": ["vn-office-gov-8662-2023"]
    },
    {
      "id": "vn.2024.lunar-new-year.compensatory-leave-1",
      "date": "2024-02-13",
      "type": "compensatory_leave",
      "title": "Nghỉ bù Tết Nguyên Đán",
      "holidayId": "vn.lunar-new-year",
      "sourceIds": ["vn-office-gov-8662-2023"]
    },
    {
      "id": "vn.2024.lunar-new-year.compensatory-leave-2",
      "date": "2024-02-14",
      "type": "compensatory_leave",
      "title": "Nghỉ bù Tết Nguyên Đán",
      "holidayId": "vn.lunar-new-year",
      "sourceIds": ["vn-office-gov-8662-2023"]
    },
    {
      "id": "vn.2024.reunification-day.exchange-leave",
      "date": "2024-04-29",
      "type": "official_leave",
      "title": "Nghỉ hoán đổi dịp 30/4 - 1/5",
      "holidayId": "vn.reunification-day",
      "sourceIds": ["vn-office-gov-2450-2024"]
    },
    {
      "id": "vn.2024.reunification-day.exchange-workday",
      "date": "2024-05-04",
      "type": "compensatory_workday",
      "title": "Làm bù dịp 30/4 - 1/5",
      "holidayId": "vn.reunification-day",
      "sourceIds": ["vn-office-gov-2450-2024"]
    },
    {
      "id": "vn.2024.national-day.additional-statutory-leave",
      "date": "2024-09-03",
      "type": "official_leave",
      "title": "Nghỉ lễ Quốc khánh",
      "holidayId": "vn.national-day",
      "sourceIds": ["vn-office-gov-8662-2023"]
    }
  ]
}
