{
  "schemaVersion": 1,
  "documentType": "official_calendar_overrides",
  "jurisdiction": { "country": "VN", "subdivision": null },
  "year": 2020,
  "scheduleScope": "public_sector_schedule",
  "status": "published",
  "updatedAt": "2026-08-13T00:00:00Z",
  "sources": [
    {
      "id": "vn-office-gov-9087-2019",
      "title": "Công văn số 9087/VPCP-KGVX về nghỉ Tết Âm lịch 2020",
      "authority": "Văn phòng Chính phủ",
      "url": "https://baochinhphu.vn/thu-tuong-chot-7-ngay-nghi-tet-nguyen-dan-canh-ty-2020-102262334.htm",
      "publishedAt": "2019-10-08"
    }
  ],
  "entries": [
    {
      "id": "vn.2020.lunar-new-year.leave-before-2",
      "date": "2020-01-23",
      "type": "official_leave",
      "title": "Nghỉ Tết Nguyên Đán",
      "holidayId": "vn.lunar-new-year",
      "sourceIds": ["vn-office-gov-9087-2019"]
    },
    {
      "id": "vn.2020.lunar-new-year.leave-before-1",
      "date": "2020-01-24",
      "type": "official_leave",
      "title": "Nghỉ Tết Nguyên Đán",
      "holidayId": "vn.lunar-new-year",
      "sourceIds": ["vn-office-gov-9087-2019"]
    },
    {
      "id": "vn.2020.lunar-new-year.leave-after-1",
      "date": "2020-01-26",
      "type": "official_leave",
      "title": "Nghỉ Tết Nguyên Đán",
      "holidayId": "vn.lunar-new-year",
      "sourceIds": ["vn-office-gov-9087-2019"]
    },
    {
      "id": "vn.2020.lunar-new-year.leave-after-2",
      "date": "2020-01-27",
      "type": "official_leave",
      "title": "Nghỉ Tết Nguyên Đán",
      "holidayId": "vn.lunar-new-year",
      "sourceIds": ["vn-office-gov-9087-2019"]
    },
    {
      "id": "vn.2020.lunar-new-year.compensatory-leave-1",
      "date": "2020-01-28",
      "type": "compensatory_leave",
      "title": "Nghỉ bù Tết Nguyên Đán",
      "holidayId": "vn.lunar-new-year",
      "sourceIds": ["vn-office-gov-9087-2019"]
    },
    {
      "id": "vn.2020.lunar-new-year.compensatory-leave-2",
      "date": "2020-01-29",
      "type": "compensatory_leave",
      "title": "Nghỉ bù Tết Nguyên Đán",
      "holidayId": "vn.lunar-new-year",
      "sourceIds": ["vn-office-gov-9087-2019"]
    }
  ]
}
