{
  "schemaVersion": 1,
  "documentType": "official_calendar_overrides",
  "jurisdiction": {
    "country": "VN",
    "subdivision": null
  },
  "year": 2012,
  "scheduleScope": "public_sector_schedule",
  "status": "published",
  "updatedAt": "2026-08-13T00:00:00Z",
  "sources": [
    {
      "id": "vn-molisa-4713-2011",
      "title": "Thông báo số 4713/TB-BLĐTBXH về việc hoán đổi ngày nghỉ hàng tuần vào dịp Tết Âm lịch 2012",
      "authority": "Bộ Lao động - Thương binh và Xã hội",
      "url": "https://thuvienphapluat.vn/van-ban/Lao-dong-Tien-luong/Thong-bao-4713-TB-BLDTBXH-hoan-doi-ngay-nghi-hang-tuan-dip-nghi-Tet-Am-lich-2012-133989.aspx",
      "publishedAt": "2011-12-30"
    }
  ],
  "entries": [
    {
      "id": "vn.2012.lunar-new-year.exchange-leave",
      "date": "2012-01-27",
      "type": "official_leave",
      "title": "Nghỉ hoán đổi Tết Nguyên Đán",
      "holidayId": "vn.lunar-new-year",
      "sourceIds": ["vn-molisa-4713-2011"]
    },
    {
      "id": "vn.2012.lunar-new-year.exchange-workday",
      "date": "2012-02-04",
      "type": "compensatory_workday",
      "title": "Làm bù Tết Nguyên Đán",
      "holidayId": "vn.lunar-new-year",
      "sourceIds": ["vn-molisa-4713-2011"]
    }
  ]
}
