{
  "schemaVersion": 1,
  "documentType": "official_calendar_overrides",
  "jurisdiction": {
    "country": "KR",
    "subdivision": null
  },
  "year": 2026,
  "scheduleScope": "nationwide_statutory",
  "status": "published",
  "updatedAt": "2026-08-13T00:00:00Z",
  "sources": [
    {
      "id": "kr-moleg-2026",
      "title": "2026년 관공서의 공휴일",
      "authority": "인사혁신처",
      "url": "https://www.mpm.go.kr/",
      "publishedAt": "2025-06-01"
    }
  ],
  "entries": [
    {
      "id": "kr.2026.seollal.leave-before",
      "date": "2026-02-16",
      "type": "official_leave",
      "title": "설날 연휴",
      "holidayId": "kr.seollal",
      "sourceIds": ["kr-moleg-2026"]
    },
    {
      "id": "kr.2026.seollal.day",
      "date": "2026-02-17",
      "type": "official_leave",
      "title": "설날",
      "holidayId": "kr.seollal",
      "sourceIds": ["kr-moleg-2026"]
    },
    {
      "id": "kr.2026.seollal.leave-after",
      "date": "2026-02-18",
      "type": "official_leave",
      "title": "설날 연휴",
      "holidayId": "kr.seollal",
      "sourceIds": ["kr-moleg-2026"]
    },
    {
      "id": "kr.2026.independence-movement.substitute",
      "date": "2026-03-02",
      "type": "compensatory_leave",
      "title": "3·1절 대체공휴일",
      "holidayId": "kr.independence-movement-day",
      "sourceIds": ["kr-moleg-2026"]
    },
    {
      "id": "kr.2026.buddhas-birthday.substitute",
      "date": "2026-05-25",
      "type": "compensatory_leave",
      "title": "부처님오신날 대체공휴일",
      "holidayId": "kr.buddhas-birthday",
      "sourceIds": ["kr-moleg-2026"]
    },
    {
      "id": "kr.2026.local-election-day",
      "date": "2026-06-03",
      "type": "official_holiday",
      "title": "제9회 전국동시지방선거",
      "holidayId": "kr.election-day",
      "sourceIds": ["kr-moleg-2026"]
    },
    {
      "id": "kr.2026.liberation-day.substitute",
      "date": "2026-08-17",
      "type": "compensatory_leave",
      "title": "광복절 대체공휴일",
      "holidayId": "kr.liberation-day",
      "sourceIds": ["kr-moleg-2026"]
    },
    {
      "id": "kr.2026.chuseok.leave-before",
      "date": "2026-09-24",
      "type": "official_leave",
      "title": "추석 연휴",
      "holidayId": "kr.chuseok",
      "sourceIds": ["kr-moleg-2026"]
    },
    {
      "id": "kr.2026.chuseok.day",
      "date": "2026-09-25",
      "type": "official_leave",
      "title": "추석",
      "holidayId": "kr.chuseok",
      "sourceIds": ["kr-moleg-2026"]
    },
    {
      "id": "kr.2026.chuseok.leave-after",
      "date": "2026-09-26",
      "type": "official_leave",
      "title": "추석 연휴",
      "holidayId": "kr.chuseok",
      "sourceIds": ["kr-moleg-2026"]
    },
    {
      "id": "kr.2026.national-foundation-day.substitute",
      "date": "2026-10-05",
      "type": "compensatory_leave",
      "title": "개천절 대체공휴일",
      "holidayId": "kr.national-foundation-day",
      "sourceIds": ["kr-moleg-2026"]
    }
  ]
}
